{
  "client_name": "Amanda Ferraz Arquitetura e Construção",
  "summary": "SWOT balanceada (5x5x5x5) mas com fragilidade estrutural real: diferencial técnico defensável (zero comissionamento, projeto sem retrabalho) e território consolidado (40+ projetos no Terras da Alvorada) convivem com dependência crítica de indicação (99%) e de Amanda pessoalmente — CRM ausente e portfólio raso ampliam o risco diante de concorrentes como Eduardo Muzi.",

  "summary_headline": "Amanda Ferraz tem diferencial técnico real e não comunicado (zero comissionamento, sem retrabalho) — mas CRM inexistente e dependência de indicação viram risco de continuidade.",

  "summary_highlights": [
    {
      "category": "posicao",
      "label": "Forças vs fraquezas",
      "value": "5 x 5",
      "subtext": "Balanceado, mas fraquezas são estruturais",
      "tone": "yellow"
    },
    {
      "category": "oportunidade",
      "label": "Top ação (CRM)",
      "value": "ROI ~30x em 90d",
      "subtext": "Investimento baixo, destrava todo o resto",
      "tone": "green"
    },
    {
      "category": "risco",
      "label": "Maior ameaça",
      "value": "Dependência de indicação (99%)",
      "subtext": "Sem canal digital próprio maduro ainda",
      "tone": "red"
    },
    {
      "category": "janela",
      "label": "Condomínios emergentes",
      "value": "2 sem 'dono' ainda",
      "subtext": "Almarias e Quinta da Primavera — janela fechando",
      "tone": "yellow"
    },
    {
      "category": "competicao",
      "label": "Concorrente mais perigoso",
      "value": "Eduardo Muzi",
      "subtext": "Disputa obra a obra, site com melhor branding",
      "tone": "yellow"
    }
  ],

  "summary_key_findings": [
    {
      "category": "vantagem",
      "text": "Amanda tem um diferencial técnico real e verificável (projeto executivo sem retrabalho + recusa de comissionamento de fornecedores) que nenhum concorrente direto comunica com a mesma força."
    },
    {
      "category": "contexto",
      "text": "O crescimento até aqui veio de um modelo replicável e já provado — virar 'a arquiteta do condomínio' organicamente (40+ projetos no Terras da Alvorada) — mas esse modelo depende de tempo e proximidade física, não escala sozinho."
    },
    {
      "category": "ameaca",
      "text": "99% da aquisição depende de indicação e da disponibilidade pessoal da Amanda — quando ela teve o filho em 2023, o crescimento desacelerou por ~6 meses. Não há canal digital alternativo maduro hoje."
    },
    {
      "category": "ameaca",
      "text": "Eduardo Muzi disputa diretamente as mesmas obras e tem o site com melhor direção de arte entre os concorrentes diretos, apesar de tecnicamente mais fraco."
    },
    {
      "category": "acao",
      "text": "Replicar o playbook do Terras da Alvorada em Almarias e Quinta da Primavera (condomínios emergentes ainda sem arquiteto-referência) antes que a janela feche."
    }
  ],

  "strengths": [
    {
      "title": "Presença territorial consolidada em condomínio-âncora",
      "description": "40+ projetos já entregues no condomínio Terras da Alvorada (Jundiaí), onde Amanda é reconhecida como referência local — clientes indicam uns aos outros dentro do próprio condomínio de forma orgânica.",
      "implication": "O modelo de 'virar a arquiteta do bairro' já está provado e pode ser replicado deliberadamente nos condomínios emergentes (Almarias, Quinta da Primavera), em vez de esperar a indicação orgânica acontecer sozinha.",
      "source": "briefing"
    },
    {
      "title": "Diferencial técnico real e verificável, ainda não comunicado publicamente",
      "description": "Projeto executivo compatibilizado evita retrabalho (caso documentado: obra de concorrente exigiu redesenho por incompatibilização estrutural x arquitetônica); recusa formal de comissionamento de fornecedores (RT), com desconto repassado em nota ao cliente — reconhecida no circuito local de fornecedores por essa prática, com prêmio de destaque como arquiteta por 2 anos consecutivos.",
      "implication": "Pode virar o eixo central de conteúdo educativo e de vendas, já que nenhum dos 3 concorrentes diretos (Eduardo Muzi, Ricardo Gaspari, Guedes e Bisoli) reivindica isso com a mesma força ou consistência.",
      "source": "briefing"
    },
    {
      "title": "Criativos e presença pessoal acima da média do setor",
      "description": "Score de 48/100 no pilar de criativos (vs. 28 de benchmark para serviços locais) — Amanda já aparece nos vídeos com autoridade técnica real, diferencial que nenhum concorrente direto replica bem (Ricardo Gaspari não aparece; Eduardo Muzi mistura vida pessoal e perde credibilidade).",
      "implication": "Já é um motor de conteúdo pronto para acelerar posicionamento territorial e educativo, sem depender de produção do zero.",
      "source": "diagnostico"
    },
    {
      "title": "Disciplina deliberada de capacidade e qualidade",
      "description": "Em 2019-2020, dobrou a operação para ~20 obras simultâneas durante a pandemia, percebeu queda de qualidade e controle, e reduziu voluntariamente para o limite atual de 8 obras — decisão estratégica rara no setor, onde a maioria cresce sem esse tipo de disciplina.",
      "implication": "Pode virar argumento de vendas explícito ('recusamos volume para manter padrão'), em vez de ser tratado apenas como limitação de capacidade.",
      "source": "operador"
    },
    {
      "title": "Saúde financeira sólida da operação",
      "description": "Inadimplência histórica praticamente zero (confirmada em 2 anos de observação da equipe interna) e 60-65% dos contratos fechados com pagamento à vista.",
      "implication": "Dá fôlego financeiro real para investir em estruturação (CRM, portfólio, mídia) sem pressão de caixa imediata — o gargalo não é capital, é organização.",
      "source": "briefing"
    }
  ],

  "weaknesses": [
    {
      "title": "CRM inexistente — 5+ anos pagando ferramenta nunca configurada",
      "description": "Score crítico de 12/100 no diagnóstico de maturidade. Bitrix pago por 5+ anos sem nunca ser configurado adequadamente; hoje avaliando ClickUp. Leads e fornecedores se misturam no mesmo WhatsApp pessoal, sem registro.",
      "implication": "Se não tratada, qualquer aumento de investimento em mídia paga repete o erro recente (R$1.200 gastos, zero clientes reais identificados) — o problema não é o criativo, é a ausência de rastreamento.",
      "severity": "critical",
      "source": "diagnostico"
    },
    {
      "title": "Operação estratégica centralizada inteiramente em Amanda",
      "description": "Cronograma de projetos e decisões-chave vivem 'na cabeça' da própria Amanda, sem processo documentado. Ela mesma reconhece isso como a maior fraqueza da empresa. Quando teve o filho em 2023, o ritmo de crescimento caiu por ~6 meses.",
      "implication": "Risco real de continuidade de negócio — qualquer imprevisto pessoal ou de saúde interrompe a operação inteira, não só o marketing. Mitigação: documentar processo no CRM em implementação e delegar decisões operacionais recorrentes.",
      "severity": "high",
      "source": "operador"
    },
    {
      "title": "Portfólio digital raso no momento decisivo de comparação",
      "description": "Site com apenas 3 projetos, identificados só por número, sem case study (contexto, metragem, resultado). Depoimentos existem só como imagem (print), não em texto — não indexável, não reaproveitável.",
      "implication": "Perde para concorrentes como Guedes e Bisoli, que usam prova social de forma mais robusta, exatamente no estágio em que a família compara 2-3 escritórios antes de decidir.",
      "severity": "high",
      "source": "diagnostico"
    },
    {
      "title": "Histórico recente de mídia paga sem estrutura de funil",
      "description": "Última campanha gastou R$1.200 em 2 semanas com uma única campanha, sem negativação de público/palavras-chave — gerou apenas conversas de fornecedores, não de clientes. Gestor de tráfego demitido após 3 semanas por falta de otimização.",
      "implication": "Risco de repetir o erro em escala maior se o plano de mídia (R$3.200-4.200/mês) for executado sem reestruturação prévia de segmentação e CRM.",
      "severity": "high",
      "source": "diagnostico"
    },
    {
      "title": "Ausência total em buscas por Inteligência Artificial",
      "description": "Achado da auditoria CRO: Amanda Ferraz não aparece em nenhuma IA generativa ao pesquisar 'arquiteto' na região, apesar do Google Meu Negócio ativo com nota 4,5. Blog do site existe na estrutura mas tem zero posts publicados.",
      "implication": "O comportamento de busca do público 40+ ainda está no Google hoje, mas a tendência de migração para IA já é real — o gap é barato e fácil de resolver agora, antes que vire crítico.",
      "severity": "medium",
      "source": "diagnostico"
    }
  ],

  "opportunities": [
    {
      "title": "Condomínios de alto padrão emergentes ainda sem 'arquiteto-referência'",
      "description": "Almarias e Quinta da Primavera são condomínios recém-lançados na região de Jundiaí, em fase de ocupação, ainda sem um arquiteto dominante estabelecido — diferente do Terras da Alvorada (onde Amanda já domina) ou do Atenas (onde Ricardo Gaspari é referência).",
      "implication": "Replicar deliberadamente o playbook que já funcionou no Terras da Alvorada nesses dois condomínios, antes que um concorrente se estabeleça lá primeiro.",
      "time_sensitivity": "medium_term",
      "source": "operador"
    },
    {
      "title": "Demanda represada de São Paulo capital buscando refúgio na região",
      "description": "Clientes de alto poder aquisitivo da Grande São Paulo, incomodados com trânsito e logística da capital, buscam construir em condomínios da região de Jundiaí — Amanda já tem prova disso (cliente de Perdizes indicado por cliente do Terras da Alvorada).",